{
  "schema": 1,
  "version": 12,
  "updated": "2026-08-30T10:38:16Z",
  "vendors": [
    {
      "id": "netflix",
      "name": "Netflix",
      "aliases": [
        "NFLX",
        "Netflix Inc"
      ],
      "domain": "netflix.com",
      "category": "Entertainment",
      "tags": [
        "streaming",
        "video"
      ],
      "iconName": "play.rectangle.fill",
      "colorHex": "#E50914",
      "tiers": [
        {
          "id": "standard_ads_monthly_ca",
          "name": "Standard with ads",
          "cycle": "monthly",
          "currency": "CAD",
          "amount": 7.99,
          "region": "CA"
        },
        {
          "id": "standard_monthly_ca",
          "name": "Standard",
          "cycle": "monthly",
          "currency": "CAD",
          "amount": 18.99,
          "region": "CA"
        },
        {
          "id": "premium_monthly_ca",
          "name": "Premium",
          "cycle": "monthly",
          "currency": "CAD",
          "amount": 23.99,
          "region": "CA"
        }
      ],
      "trial": {
        "lengthDays": 0
      },
      "cancellation": {
        "method": "web",
        "url": "https://www.netflix.com/cancelplan",
        "steps": [
          "Sign in at netflix.com",
          "Account \u2192 Membership \u2192 Cancel Membership",
          "Confirm cancellation"
        ],
        "retentionOffer": "May offer a discount or downgrade. Decline if you want to actually cancel.",
        "estimatedMinutes": 3
      },
      "simpleIconsSlug": "netflix",
      "priceHistory": [
        {
          "tierId": "standard_monthly_ca",
          "currency": "CAD",
          "amount": 18.99,
          "effectiveFrom": "2026-06-04"
        }
      ]
    },
    {
      "id": "spotify",
      "name": "Spotify",
      "aliases": [
        "Spotify Premium"
      ],
      "domain": "spotify.com",
      "category": "Entertainment",
      "tags": [
        "streaming",
        "music"
      ],
      "iconName": "music.note",
      "colorHex": "#1DB954",
      "tiers": [
        {
          "id": "individual_monthly_ca",
          "name": "Premium Individual",
          "cycle": "monthly",
          "currency": "CAD",
          "amount": 13.99,
          "region": "CA"
        },
        {
          "id": "duo_monthly_ca",
          "name": "Premium Duo",
          "cycle": "monthly",
          "currency": "CAD",
          "amount": 19.99,
          "region": "CA"
        },
        {
          "id": "family_monthly_ca",
          "name": "Premium Family",
          "cycle": "monthly",
          "currency": "CAD",
          "amount": 23.99,
          "region": "CA"
        },
        {
          "id": "student_monthly_ca",
          "name": "Premium Student",
          "cycle": "monthly",
          "currency": "CAD",
          "amount": 6.39,
          "region": "CA"
        }
      ],
      "trial": {
        "lengthDays": 30
      },
      "cancellation": {
        "method": "web",
        "url": "https://www.spotify.com/account/subscription/",
        "steps": [
          "Sign in at spotify.com",
          "Account \u2192 Available plans \u2192 Cancel Premium",
          "Confirm; access continues until end of billing period"
        ],
        "retentionOffer": "May offer 3 months at a reduced rate.",
        "estimatedMinutes": 2
      },
      "simpleIconsSlug": "spotify"
    },
    {
      "id": "disney_plus",
      "name": "Disney+",
      "aliases": [
        "Disney Plus"
      ],
      "domain": "disneyplus.com",
      "category": "Entertainment",
      "tags": [
        "streaming",
        "video"
      ],
      "iconName": "sparkles.tv",
      "colorHex": "#113CCF",
      "tiers": [
        {
          "id": "standard_ads_monthly_ca",
          "name": "Standard with Ads",
          "cycle": "monthly",
          "currency": "CAD",
          "amount": 8.99,
          "region": "CA"
        },
        {
          "id": "standard_monthly_ca",
          "name": "Standard",
          "cycle": "monthly",
          "currency": "CAD",
          "amount": 15.99,
          "region": "CA"
        },
        {
          "id": "standard_yearly_ca",
          "name": "Standard",
          "cycle": "yearly",
          "currency": "CAD",
          "amount": 159.99,
          "region": "CA"
        },
        {
          "id": "premium_monthly_ca",
          "name": "Premium",
          "cycle": "monthly",
          "currency": "CAD",
          "amount": 16.99,
          "region": "CA"
        },
        {
          "id": "premium_yearly_ca",
          "name": "Premium",
          "cycle": "yearly",
          "currency": "CAD",
          "amount": 169.99,
          "region": "CA"
        }
      ],
      "trial": {
        "lengthDays": 7
      },
      "cancellation": {
        "method": "web",
        "url": "https://www.disneyplus.com/account/subscription",
        "steps": [
          "Sign in at disneyplus.com",
          "Account \u2192 Subscription \u2192 Cancel Subscription",
          "Select reason and confirm"
        ],
        "retentionOffer": "May offer a free month or discount.",
        "estimatedMinutes": 3
      }
    },
    {
      "id": "youtube_premium",
      "name": "YouTube Premium",
      "aliases": [
        "YouTube Music Premium"
      ],
      "domain": "youtube.com",
      "category": "Entertainment",
      "tags": [
        "streaming",
        "video",
        "music"
      ],
      "iconName": "play.rectangle.fill",
      "colorHex": "#FF0000",
      "tiers": [
        {
          "id": "individual_monthly_ca",
          "name": "Individual",
          "cycle": "monthly",
          "currency": "CAD",
          "amount": 13.99,
          "region": "CA"
        },
        {
          "id": "family_monthly_ca",
          "name": "Family",
          "cycle": "monthly",
          "currency": "CAD",
          "amount": 25.99,
          "region": "CA"
        },
        {
          "id": "student_monthly_ca",
          "name": "Student",
          "cycle": "monthly",
          "currency": "CAD",
          "amount": 7.99,
          "region": "CA"
        }
      ],
      "trial": {
        "lengthDays": 30
      },
      "cancellation": {
        "method": "web",
        "url": "https://www.youtube.com/paid_memberships",
        "steps": [
          "Sign in at youtube.com",
          "Open Paid Memberships",
          "Select YouTube Premium \u2192 Manage \u2192 Deactivate"
        ],
        "retentionOffer": "May offer pause for up to 6 months instead of cancelling.",
        "estimatedMinutes": 3
      },
      "simpleIconsSlug": "youtube"
    },
    {
      "id": "apple_tv_plus",
      "name": "Apple TV+",
      "aliases": [
        "Apple TV Plus"
      ],
      "domain": "tv.apple.com",
      "category": "Entertainment",
      "tags": [
        "streaming",
        "video"
      ],
      "iconName": "appletv",
      "colorHex": "#000000",
      "tiers": [
        {
          "id": "standard_monthly_ca",
          "name": "Standard",
          "cycle": "monthly",
          "currency": "CAD",
          "amount": 14.99,
          "region": "CA"
        },
        {
          "id": "standard_yearly_ca",
          "name": "Standard",
          "cycle": "yearly",
          "currency": "CAD",
          "amount": 129.0,
          "region": "CA"
        }
      ],
      "trial": {
        "lengthDays": 7
      },
      "cancellation": {
        "method": "app",
        "url": "https://support.apple.com/en-us/118428",
        "steps": [
          "Settings \u2192 [your name] \u2192 Subscriptions",
          "Tap Apple TV+ \u2192 Cancel Subscription",
          "Confirm"
        ],
        "retentionOffer": "Apple typically does not offer retention discounts.",
        "estimatedMinutes": 1
      },
      "simpleIconsSlug": "appletv"
    },
    {
      "id": "apple_music",
      "name": "Apple Music",
      "aliases": [],
      "domain": "music.apple.com",
      "category": "Entertainment",
      "tags": [
        "streaming",
        "music"
      ],
      "iconName": "music.note.list",
      "colorHex": "#FA2D48",
      "tiers": [
        {
          "id": "student_monthly_ca",
          "name": "Student",
          "cycle": "monthly",
          "currency": "CAD",
          "amount": 5.99,
          "region": "CA"
        },
        {
          "id": "individual_monthly_ca",
          "name": "Individual",
          "cycle": "monthly",
          "currency": "CAD",
          "amount": 10.99,
          "region": "CA"
        },
        {
          "id": "individual_yearly_ca",
          "name": "Individual",
          "cycle": "yearly",
          "currency": "CAD",
          "amount": 119.0,
          "region": "CA"
        },
        {
          "id": "family_monthly_ca",
          "name": "Family",
          "cycle": "monthly",
          "currency": "CAD",
          "amount": 16.99,
          "region": "CA"
        }
      ],
      "trial": {
        "lengthDays": 30
      },
      "cancellation": {
        "method": "app",
        "url": "https://support.apple.com/en-us/118428",
        "steps": [
          "Settings \u2192 [your name] \u2192 Subscriptions",
          "Tap Apple Music \u2192 Cancel Subscription"
        ],
        "retentionOffer": "Apple typically does not offer retention discounts.",
        "estimatedMinutes": 1
      },
      "simpleIconsSlug": "applemusic",
      "priceHistory": [
        {
          "tierId": "individual_monthly_ca",
          "currency": "CAD",
          "amount": 10.99,
          "effectiveFrom": "2026-06-04"
        },
        {
          "tierId": "family_monthly_ca",
          "currency": "CAD",
          "amount": 16.99,
          "effectiveFrom": "2026-06-04"
        }
      ]
    },
    {
      "id": "amazon_prime_video",
      "name": "Amazon Prime Video",
      "aliases": [
        "Prime Video"
      ],
      "domain": "primevideo.com",
      "category": "Entertainment",
      "tags": [